{"$schema":"https://json-schema.org/draft/2020-12/schema","title":"Mint Journey OS record","type":"object","additionalProperties":false,"required":["schema_version","id","title","tier","status","human_promise","accountable_team","route_paths","surfaces","external_apis","issues","evidence"],"properties":{"schema_version":{"const":1},"id":{"type":"string","minLength":1},"title":{"type":"string","minLength":1},"tier":{"enum":["T0","T1","T2","T3"]},"status":{"enum":["draft","partial","live_proven","blocked","deferred","out_of_beta"]},"human_promise":{"type":"string","minLength":1},"accountable_team":{"enum":["mint-lead","mint-quality-gate","mint-mobile","mint-backend","mint-swiss-brain"]},"route_paths":{"type":"array","items":{"type":"string"}},"surfaces":{"type":"array","items":{"type":"string"}},"external_apis":{"type":"array","items":{"type":"string"}},"issues":{"type":"array","items":{"type":"string"}},"evidence":{"type":"array","minItems":1,"items":{"type":"object","additionalProperties":false,"required":["kind","status","command","artifact"],"properties":{"kind":{"enum":["unit","widget","static_guard","runtime","manual","external"]},"status":{"enum":["green","red","missing","baselined"]},"command":{"type":["string","null"]},"artifact":{"type":["string","null"]},"reason":{"type":"string"},"debt_ref":{"type":"string"},"verified_at":{"type":"string"},"verified_commit":{"type":"string"}}}}}}
